{"schemaVersion":1,"taskId":"agents-md-update","version":"2.0.0","publisher":"Hagicode Team","source":"https://github.com/HagiCode-org/hagitask-community-packages","publishedAt":"2026-10-24T18:06:23.284Z","generatedAt":"2026-10-24T18:06:23.284Z","name":{"en-US":"AGENTS.md Update","zh-CN":"AGENTS.md 更新"},"summary":{"en-US":"A structured documentation-maintenance task preset that updates only AGENTS.md with explicit project selection and MonoSpecs-aware repository scope, leaving CLAUDE.md untouched.","zh-CN":"一个仅更新 AGENTS.md 的结构化文档维护 task preset，支持显式项目选择与 MonoSpecs 感知仓库范围，保持 CLAUDE.md 原样。"},"description":{"en-US":"A structured documentation-maintenance task preset that updates only AGENTS.md with explicit project selection and MonoSpecs-aware repository scope, leaving CLAUDE.md untouched.","zh-CN":"一个仅更新 AGENTS.md 的结构化文档维护 task preset，支持显式项目选择与 MonoSpecs 感知仓库范围，保持 CLAUDE.md 原样。"},"category":"documentation","tags":["documentation","maintenance","agents-md","monospecs"],"compatibility":{"agent":"any","skills":[],"cli":[]},"requirements":[{"type":"agent","name":"any"}],"resources":{"manifest":"manifest.json","backend":"backend/","frontend":"frontend/","prompts":"backend/prompts.json","locales":["locales/en-US.json","locales/zh-CN.json"],"storePage":["store-page/index.en-US.md","store-page/index.zh-CN.md"]},"installation":{"packageUrl":"/packages/agents-md-update.zip","mediaType":"application/zip","size":32938,"sha256":"fe79fc28724431a28cfa57f74d9c64af49d58e409d7077a61068fddf05aaa69a","algorithm":"sha256"},"documentation":{"storePage":{"en-US":"/tasks/agents-md-update/","zh-CN":"/tasks/agents-md-update/"},"external":[{"label":"Source store page","url":"https://github.com/HagiCode-org/hagitask-community-packages/blob/main/data/agents-md-update/store-page/index.en-US.md"}]},"localization":{"defaultLocale":"en-US","supportedLocales":["en-US","zh-CN"]},"metadata":{"owner":"Hagicode Team"}}