{"schemaVersion":1,"taskId":"codegraph-tasks","version":"1.0.0","publisher":"HagiCode Team","source":"https://github.com/HagiCode-org/hagitask-community-packages","publishedAt":"2026-10-17T05:34:19.761Z","generatedAt":"2026-10-17T05:34:19.761Z","name":{"en-US":"CodeGraph Tasks","zh-CN":"CodeGraph 任务"},"summary":{"en-US":"Run localized CodeGraph lifecycle and graph-backed architecture tasks across eligible repositories.","zh-CN":"对合格仓库执行本地化的 CodeGraph 生命周期和基于图的架构任务。"},"description":{"en-US":"Run localized CodeGraph lifecycle and graph-backed architecture tasks across eligible repositories.","zh-CN":"对合格仓库执行本地化的 CodeGraph 生命周期和基于图的架构任务。"},"category":"codegraph","tags":["codegraph","architecture","repository","automation"],"compatibility":{"agent":"any","skills":[],"cli":[]},"requirements":[{"type":"agent","name":"any"}],"resources":{"manifest":"manifest.json","backend":"backend/","frontend":"frontend/","prompts":"backend/prompts.json","locales":["locales/en-US.json","locales/zh-CN.json"],"storePage":["store-page/index.en-US.md","store-page/index.zh-CN.md"]},"installation":{"packageUrl":"/packages/codegraph-tasks.zip","mediaType":"application/zip","size":32004,"sha256":"9c97beb4cd873d31077cd98ec709476f0d8640a87db6fdff3405368689b041fa","algorithm":"sha256"},"documentation":{"storePage":{"en-US":"/tasks/codegraph-tasks/","zh-CN":"/tasks/codegraph-tasks/"},"external":[{"label":"Source store page","url":"https://github.com/HagiCode-org/hagitask-community-packages/blob/main/data/codegraph-tasks/store-page/index.en-US.md"}]},"localization":{"defaultLocale":"en-US","supportedLocales":["en-US","zh-CN"]},"metadata":{"owner":"HagiCode Team"}}