{"schemaVersion":1,"taskId":"add-community-task","version":"1.0.2","publisher":"Hagicode Team","source":"https://github.com/HagiCode-org/hagitask-community-packages","publishedAt":"2026-10-24T18:06:22.956Z","generatedAt":"2026-10-24T18:06:22.956Z","name":{"en-US":"Add Community Task","zh-CN":"Add Community Task"},"summary":{"en-US":"Collect one complete Community Task brief, structure it with the prompt, generate every required package file, validate it for real, and open a pull request from your own GitHub fork.","zh-CN":"在一个集中说明中收集 Community Task 意图，由提示词完成结构化整理，生成全部必需的包文件，真实执行校验，并从你自己的 GitHub fork 创建 Pull Request。"},"description":{"en-US":"Collect one complete Community Task brief, structure it with the prompt, generate every required package file, validate it for real, and open a pull request from your own GitHub fork.","zh-CN":"在一个集中说明中收集 Community Task 意图，由提示词完成结构化整理，生成全部必需的包文件，真实执行校验，并从你自己的 GitHub fork 创建 Pull Request。"},"category":"authoring","tags":["authoring","community","community-packages","scaffolding","github-pull-request","bilingual"],"compatibility":{"agent":"any","skills":[],"cli":[{"name":"gh","command":"gh","args":["--version"]},{"name":"git","command":"git","args":["--version"]},{"name":"node","command":"node","args":["--version"]}]},"requirements":[{"type":"agent","name":"any"},{"type":"cli","name":"gh","command":"gh","args":["--version"]},{"type":"cli","name":"git","command":"git","args":["--version"]},{"type":"cli","name":"node","command":"node","args":["--version"]}],"resources":{"manifest":"manifest.json","backend":"backend/","frontend":"frontend/","prompts":"backend/prompts.json","locales":["locales/en-US.json","locales/zh-CN.json"],"storePage":["store-page/index.en-US.md","store-page/index.zh-CN.md"]},"installation":{"packageUrl":"/packages/add-community-task.zip","mediaType":"application/zip","size":42754,"sha256":"a00cc80491f96b9715485fa5fe022e55f255915cc7089dd141228ca25f3023ce","algorithm":"sha256"},"documentation":{"storePage":{"en-US":"/tasks/add-community-task/","zh-CN":"/tasks/add-community-task/"},"external":[{"label":"Source store page","url":"https://github.com/HagiCode-org/hagitask-community-packages/blob/main/data/add-community-task/store-page/index.en-US.md"}]},"localization":{"defaultLocale":"en-US","supportedLocales":["en-US","zh-CN"]},"metadata":{"owner":"Hagicode Team"}}