{"schemaVersion":1,"taskId":"ui-master","version":"1.0.2","publisher":"Hagicode Team","source":"https://github.com/HagiCode-org/hagitask-community-packages","publishedAt":"2026-10-17T05:34:21.403Z","generatedAt":"2026-10-17T05:34:21.403Z","name":{"en-US":"UI Master","zh-CN":"UI Master"},"summary":{"en-US":"A structured UI task preset that combines command-guided intent, repository scope, and scene-aware dispatch for focused interface work.","zh-CN":"一个面向结构化 UI 任务的 task preset，把命令驱动意图、仓库范围和场景化派发组合到同一个契约里。"},"description":{"en-US":"A structured UI task preset that combines command-guided intent, repository scope, and scene-aware dispatch for focused interface work.","zh-CN":"一个面向结构化 UI 任务的 task preset，把命令驱动意图、仓库范围和场景化派发组合到同一个契约里。"},"category":"ui","tags":["ui","design-tools","scene-aware","repository-scoped","command-driven"],"compatibility":{"agent":"any","skills":["impeccable"],"cli":[]},"requirements":[{"type":"agent","name":"any"},{"type":"skills","name":"impeccable"}],"resources":{"manifest":"manifest.json","backend":"backend/","frontend":"frontend/","prompts":"backend/prompts.json","locales":["locales/en-US.json","locales/zh-CN.json"],"storePage":["store-page/index.en-US.md","store-page/index.zh-CN.md"]},"installation":{"packageUrl":"/packages/ui-master.zip","mediaType":"application/zip","size":37305,"sha256":"8eeea7d1e504d96bbc9ec8b3646eb0b9ee682b2080969f5eade80ab53f2f8d24","algorithm":"sha256"},"documentation":{"storePage":{"en-US":"/tasks/ui-master/","zh-CN":"/tasks/ui-master/"},"external":[{"label":"Source store page","url":"https://github.com/HagiCode-org/hagitask-community-packages/blob/main/data/ui-master/store-page/index.en-US.md"}]},"localization":{"defaultLocale":"en-US","supportedLocales":["en-US","zh-CN"]},"metadata":{"owner":"Hagicode Team"}}