{"schemaVersion":1,"taskId":"ponytail","version":"1.0.1","publisher":"Hagicode Team","source":"https://github.com/HagiCode-org/hagitask-community-packages","publishedAt":"2026-10-17T05:34:21.164Z","generatedAt":"2026-10-17T05:34:21.164Z","name":{"en-US":"Ponytail","zh-CN":"Ponytail"},"summary":{"en-US":"A structured task preset that routes work through the Ponytail efficiency ladder and its focused review, audit, debt, and help commands.","zh-CN":"一个结构化任务预设，把工作路由到 Ponytail 效率阶梯，以及它的 review、audit、debt、help 命令。"},"description":{"en-US":"A structured task preset that routes work through the Ponytail efficiency ladder and its focused review, audit, debt, and help commands.","zh-CN":"一个结构化任务预设，把工作路由到 Ponytail 效率阶梯，以及它的 review、audit、debt、help 命令。"},"category":"efficiency","tags":["efficiency","repository-scoped","command-driven","skills-first"],"compatibility":{"agent":"any","skills":["ponytail","ponytail-review","ponytail-audit","ponytail-debt","ponytail-help"],"cli":[]},"requirements":[{"type":"agent","name":"any"},{"type":"skills","name":"ponytail"},{"type":"skills","name":"ponytail-review"},{"type":"skills","name":"ponytail-audit"},{"type":"skills","name":"ponytail-debt"},{"type":"skills","name":"ponytail-help"}],"resources":{"manifest":"manifest.json","backend":"backend/","frontend":"frontend/","prompts":"backend/prompts.json","locales":["locales/en-US.json","locales/zh-CN.json"],"storePage":["store-page/index.en-US.md","store-page/index.zh-CN.md"]},"installation":{"packageUrl":"/packages/ponytail.zip","mediaType":"application/zip","size":30162,"sha256":"94b6631775cb8f7594920cfb79d952428f57027aa51c7c13df79e3a1adbe84af","algorithm":"sha256"},"documentation":{"storePage":{"en-US":"/tasks/ponytail/","zh-CN":"/tasks/ponytail/"},"external":[{"label":"Source store page","url":"https://github.com/HagiCode-org/hagitask-community-packages/blob/main/data/ponytail/store-page/index.en-US.md"}]},"localization":{"defaultLocale":"en-US","supportedLocales":["en-US","zh-CN"]},"metadata":{"owner":"Hagicode Team"}}