{"schemaVersion":1,"taskId":"goal","version":"1.0.1","publisher":"Hagicode Team","source":"https://github.com/HagiCode-org/hagitask-community-packages","publishedAt":"2026-10-31T06:57:59.982Z","generatedAt":"2026-10-31T06:57:59.982Z","name":{"en-US":"Goal","zh-CN":"Goal"},"summary":{"en-US":"A bundled sustained-work preset that routes work through `/goal` and limits execution to compatible Claude and Codex heroes.","zh-CN":"一个内置的持续工作预设，通过 `/goal` 路由任务，并把执行限制在兼容的 Claude / Codex 英雄上。"},"description":{"en-US":"A bundled sustained-work preset that routes work through `/goal` and limits execution to compatible Claude and Codex heroes.","zh-CN":"一个内置的持续工作预设，通过 `/goal` 路由任务，并把执行限制在兼容的 Claude / Codex 英雄上。"},"category":"sustained-work","tags":["sustained-work","repository-scoped","compatibility-aware"],"compatibility":{"agent":"any","skills":[],"cli":[]},"requirements":[{"type":"agent","name":"any"}],"resources":{"manifest":"manifest.json","backend":"backend/","frontend":"frontend/","prompts":"backend/prompts.json","locales":["locales/en-US.json","locales/zh-CN.json"],"storePage":["store-page/index.en-US.md","store-page/index.zh-CN.md"]},"installation":{"packageUrl":"/packages/goal.zip","mediaType":"application/zip","size":33707,"sha256":"7d4a395c6b9ffbc9f4f47e8b51a9d2a8795542f3a007f38936c7cfda20081567","algorithm":"sha256"},"documentation":{"storePage":{"en-US":"/tasks/goal/","zh-CN":"/tasks/goal/"},"external":[{"label":"Source store page","url":"https://github.com/HagiCode-org/hagitask-community-packages/blob/main/data/goal/store-page/index.en-US.md"}]},"localization":{"defaultLocale":"en-US","supportedLocales":["en-US","zh-CN"]},"metadata":{"owner":"Hagicode Team"}}