{"schemaVersion":1,"taskId":"openspec-spec-compress","version":"1.0.1","publisher":"Hagicode Team","source":"https://github.com/HagiCode-org/hagitask-community-packages","publishedAt":"2026-10-17T05:34:20.927Z","generatedAt":"2026-10-17T05:34:20.927Z","name":{"en-US":"OpenSpec Spec Compress","zh-CN":"OpenSpec Spec Compress"},"summary":{"en-US":"A bundled OpenSpec maintenance preset that turns the documented spec-compression workflow into a reusable, non-interactive task entry.","zh-CN":"一个内置的 OpenSpec 维护 preset，把文档化的 spec 压缩流程收敛成可复用、默认非交互的任务入口。"},"description":{"en-US":"A bundled OpenSpec maintenance preset that turns the documented spec-compression workflow into a reusable, non-interactive task entry.","zh-CN":"一个内置的 OpenSpec 维护 preset，把文档化的 spec 压缩流程收敛成可复用、默认非交互的任务入口。"},"category":"openspec","tags":["openspec","maintenance","spec-compression"],"compatibility":{"agent":"any","skills":[],"cli":[{"name":"openspec","command":"openspec","args":["--help"]}]},"requirements":[{"type":"agent","name":"any"},{"type":"cli","name":"openspec","command":"openspec","args":["--help"]}],"resources":{"manifest":"manifest.json","backend":"backend/","frontend":"frontend/","prompts":"backend/prompts.json","locales":["locales/en-US.json","locales/zh-CN.json"],"storePage":["store-page/index.en-US.md","store-page/index.zh-CN.md"]},"installation":{"packageUrl":"/packages/openspec-spec-compress.zip","mediaType":"application/zip","size":25618,"sha256":"21ba0110a2518af4089da93824ad183d2d886fe12233c7c0f7b87efeeb1fc539","algorithm":"sha256"},"documentation":{"storePage":{"en-US":"/tasks/openspec-spec-compress/","zh-CN":"/tasks/openspec-spec-compress/"},"external":[{"label":"Source store page","url":"https://github.com/HagiCode-org/hagitask-community-packages/blob/main/data/openspec-spec-compress/store-page/index.en-US.md"}]},"localization":{"defaultLocale":"en-US","supportedLocales":["en-US","zh-CN"]},"metadata":{"owner":"Hagicode Team"}}