{"schemaVersion":1,"taskId":"github-tasks","version":"1.0.2","publisher":"HagiCode Team","source":"https://github.com/HagiCode-org/hagitask-community-packages","publishedAt":"2026-10-31T06:57:59.678Z","generatedAt":"2026-10-31T06:57:59.678Z","name":{"en-US":"GitHub Tasks","zh-CN":"GitHub 任务"},"summary":{"en-US":"Run focused GitHub management commands through gh CLI without persistent local artifacts.","zh-CN":"通过 gh CLI 运行专注的 GitHub 管理命令，不留下持久化本地文件。"},"description":{"en-US":"Run focused GitHub management commands through gh CLI without persistent local artifacts.","zh-CN":"通过 gh CLI 运行专注的 GitHub 管理命令，不留下持久化本地文件。"},"category":"github","tags":["github","repository-metadata","gh-cli","automation"],"compatibility":{"agent":"any","skills":[],"cli":[{"name":"gh","command":"gh","args":["--version"]},{"name":"node","command":"node","args":["--version"]}]},"requirements":[{"type":"agent","name":"any"},{"type":"cli","name":"gh","command":"gh","args":["--version"]},{"type":"cli","name":"node","command":"node","args":["--version"]}],"resources":{"manifest":"manifest.json","backend":"backend/","frontend":"frontend/","prompts":"backend/prompts.json","locales":["locales/en-US.json","locales/zh-CN.json"],"storePage":["store-page/index.en-US.md","store-page/index.zh-CN.md"]},"installation":{"packageUrl":"/packages/github-tasks.zip","mediaType":"application/zip","size":28662,"sha256":"1a0c8a330b8fcbffd92c7f15700964ed2fb13e77bccb00129bbcd2f4b6ba6294","algorithm":"sha256"},"documentation":{"storePage":{"en-US":"/tasks/github-tasks/","zh-CN":"/tasks/github-tasks/"},"external":[{"label":"Source store page","url":"https://github.com/HagiCode-org/hagitask-community-packages/blob/main/data/github-tasks/store-page/index.en-US.md"}]},"localization":{"defaultLocale":"en-US","supportedLocales":["en-US","zh-CN"]},"metadata":{"owner":"HagiCode Team"}}