{"schemaVersion":1,"taskId":"hagicode-monospecs-operations","version":"1.0.1","publisher":"Hagicode Team","source":"https://github.com/HagiCode-org/hagitask-community-packages","publishedAt":"2026-10-17T05:34:20.461Z","generatedAt":"2026-10-17T05:34:20.461Z","name":{"en-US":"HagiCode MonoSpecs Operations","zh-CN":"HagiCode MonoSpecs 操作"},"summary":{"en-US":"Initialize MonoSpecs configuration, batch-add repositories, and reorder repositories by observable activity through a structured task.","zh-CN":"通过结构化任务初始化 MonoSpecs 配置、批量添加仓库并按活跃状态调整仓库顺序。"},"description":{"en-US":"Initialize MonoSpecs configuration, batch-add repositories, and reorder repositories by observable activity through a structured task.","zh-CN":"通过结构化任务初始化 MonoSpecs 配置、批量添加仓库并按活跃状态调整仓库顺序。"},"category":"configuration","tags":["configuration","repositories","monospecs","bilingual","validation"],"compatibility":{"agent":"any","skills":[],"cli":[{"name":"git","command":"git","args":["--version"]},{"name":"node","command":"node","args":["--version"]}]},"requirements":[{"type":"agent","name":"any"},{"type":"cli","name":"git","command":"git","args":["--version"]},{"type":"cli","name":"node","command":"node","args":["--version"]}],"resources":{"manifest":"manifest.json","backend":"backend/","frontend":"frontend/","prompts":"backend/prompts.json","locales":["locales/en-US.json","locales/zh-CN.json"],"storePage":["store-page/index.en-US.md","store-page/index.zh-CN.md"]},"installation":{"packageUrl":"/packages/hagicode-monospecs-operations.zip","mediaType":"application/zip","size":26514,"sha256":"589c07c4460040c7b4ad301cae82a27114eb516853e3823e05ee61bb405d035a","algorithm":"sha256"},"documentation":{"storePage":{"en-US":"/tasks/hagicode-monospecs-operations/","zh-CN":"/tasks/hagicode-monospecs-operations/"},"external":[{"label":"Source store page","url":"https://github.com/HagiCode-org/hagitask-community-packages/blob/main/data/hagicode-monospecs-operations/store-page/index.en-US.md"}]},"localization":{"defaultLocale":"en-US","supportedLocales":["en-US","zh-CN"]},"metadata":{"owner":"Hagicode Team"}}