{"schemaVersion":1,"taskId":"last30days","version":"1.0.1","publisher":"Hagicode Team","source":"https://github.com/HagiCode-org/hagitask-community-packages","publishedAt":"2026-10-17T05:34:20.693Z","generatedAt":"2026-10-17T05:34:20.693Z","name":{"en-US":"last30days","zh-CN":"last30days"},"summary":{"en-US":"A structured research task preset that maps shared preset-task input into a mode-aware `last30days` workflow with explicit repository scope.","zh-CN":"一个结构化研究 task preset，把共享 preset-task 输入映射成具备模式感知能力的 `last30days` 工作流，并显式保留仓库范围。"},"description":{"en-US":"A structured research task preset that maps shared preset-task input into a mode-aware `last30days` workflow with explicit repository scope.","zh-CN":"一个结构化研究 task preset，把共享 preset-task 输入映射成具备模式感知能力的 `last30days` 工作流，并显式保留仓库范围。"},"category":"research","tags":["research","analysis","repository-scoped","command-driven"],"compatibility":{"agent":"any","skills":["last30days"],"cli":[]},"requirements":[{"type":"agent","name":"any"},{"type":"skills","name":"last30days"}],"resources":{"manifest":"manifest.json","backend":"backend/","frontend":"frontend/","prompts":"backend/prompts.json","locales":["locales/en-US.json","locales/zh-CN.json"],"storePage":["store-page/index.en-US.md","store-page/index.zh-CN.md"]},"installation":{"packageUrl":"/packages/last30days.zip","mediaType":"application/zip","size":25683,"sha256":"76c27b4f0fd1fba6c1fec21b706b6924d81292ad07f95eba29fae1ede97db2fc","algorithm":"sha256"},"documentation":{"storePage":{"en-US":"/tasks/last30days/","zh-CN":"/tasks/last30days/"},"external":[{"label":"Source store page","url":"https://github.com/HagiCode-org/hagitask-community-packages/blob/main/data/last30days/store-page/index.en-US.md"}]},"localization":{"defaultLocale":"en-US","supportedLocales":["en-US","zh-CN"]},"metadata":{"owner":"Hagicode Team"}}